title,description,content,source,author,url,publishedAt,language,translated_title,translated_content,translated_description
"5 details about Executive Branch, DC's new private club for young, MAGA-minded millionaires","DC has a new Trump-aligned private club for the ""younger, hipper"" Republican. Membership can cost $500,000.","Omeed Malik and Donald Trump Jr. are two of the Executive Branch owners.Ryan Emberley/amfAR/Getty Images for amfAR
<ul><li>There's a new, Trump-aligned private club in DC, where membership can reach… [+3457 chars]",Business Insider,Alice Tecotzky,https://www.businessinsider.com/executive-branch-private-club-details-trump-billionaires-2025-5,2025-05-06T16:12:38Z,en,"5 details about Executive Branch, DC's new private club for young, MAGA-minded millionaires","Omeed Malik and Donald Trump Jr. are two of the Executive Branch owners.Ryan Emberley/amfAR/Getty Images for amfAR
<ul><li>There's a new, Trump-aligned private club in DC, where membership can reach… [+3457 chars]","DC has a new Trump-aligned private club for the ""younger, hipper"" Republican. Membership can cost $500,000."
5 lessons everyday investors can take from Warren Buffett's legendary career,"Uncover five investment strategies inspired by Warren Buffett to elevate your portfolio, like the importance of cash reserves and discipline.","Warren Buffett's famous quote, ""be fearful when others are greedy and greedy when others are fearful,"" inspired 26-year-old Natalie Fisher to start investing in the stock market in 2020.
Fisher's st… [+5285 chars]",Business Insider,cji@businessinsider.com (Christine Ji),https://www.businessinsider.com/warren-buffett-career-lessons-berkshire-hathaway-succession-stocks-value-investing-2025-5,2025-05-05T18:42:31Z,en,5 lessons everyday investors can take from Warren Buffett's legendary career,"Warren Buffett's famous quote, ""be fearful when others are greedy and greedy when others are fearful,"" inspired 26-year-old Natalie Fisher to start investing in the stock market in 2020.
Fisher's st… [+5285 chars]","Uncover five investment strategies inspired by Warren Buffett to elevate your portfolio, like the importance of cash reserves and discipline."
"Bitcoin just hit $100,000 for the first time in 3 months","Bitcoin climbed past $100,000 for the first time since early February on Thursday, boosted by trade developments and rising risk appetite among investors.","Bitcoin reclaimed the six-figure mark on Thursday, crossing $100,000 for the first time in three months. 
The top crypto hit an intraday high of $101,370, the highest level since early February.
A … [+1955 chars]",Business Insider,fdemott@businessinsider.com (Filip De Mott),https://www.businessinsider.com/bitcoin-price-crypto-tariffs-cryptocurrency-fed-trade-deal-btc-2025-5,2025-05-08T17:26:44Z,en,"Bitcoin just hit $100,000 for the first time in 3 months","Bitcoin reclaimed the six-figure mark on Thursday, crossing $100,000 for the first time in three months. 
The top crypto hit an intraday high of $101,370, the highest level since early February.
A … [+1955 chars]","Bitcoin climbed past $100,000 for the first time since early February on Thursday, boosted by trade developments and rising risk appetite among investors."
This new Palantir-alumni-founded startup wants to help governments and companies control their data,"Data management startup Valarian, founded by a Palantir alumni, raises $20 million to expand its secure ACRA platform into the defense sector.","Josh McLaughlin (left) and Max Buchan (right), cofounders of Valarian. Valarian
<ul><li>Data management startup Valarian emerges from stealth and raises $7 million, bringing its seed round to $20 mi… [+4307 chars]",Business Insider,Julia Hornstein,https://www.businessinsider.com/valarian-launches-expand-data-management-platform-defense-2025-5,2025-05-08T09:00:01Z,en,This new Palantir-alumni-founded startup wants to help governments and companies control their data,"Josh McLaughlin (left) and Max Buchan (right), cofounders of Valarian. Valarian
<ul><li>Data management startup Valarian emerges from stealth and raises $7 million, bringing its seed round to $20 mi… [+4307 chars]","Data management startup Valarian, founded by a Palantir alumni, raises $20 million to expand its secure ACRA platform into the defense sector."
"After selling OnlyFans, its cofounder is launching a rival creator platform","OnlyFans cofounder Tim Stokely is launching another subscription platform called Subs, which mixes free and paid content.","OnlyFans cofounder Tim Stokely is unveiling his next act.
Stokely is launching a rival subscription platform called Subs that will house both safe-for-work and adult content under one roof.
So, how… [+3127 chars]",Business Insider,insider@insider.com (Geoff Weiss),https://www.businessinsider.com/onlyfans-cofounder-tim-stokely-launches-rival-creator-platform-subs-2025-5,2025-05-08T07:00:01Z,en,"After selling OnlyFans, its cofounder is launching a rival creator platform","OnlyFans cofounder Tim Stokely is unveiling his next act.
Stokely is launching a rival subscription platform called Subs that will house both safe-for-work and adult content under one roof.
So, how… [+3127 chars]","OnlyFans cofounder Tim Stokely is launching another subscription platform called Subs, which mixes free and paid content."
Trump's crypto dealings are jeopardizing a bipartisan stablecoin bill,"Elizabeth Warren slammed Trump's crypto dealings and said a bipartisan stablecoin bill moving through Congress needs ""substantive reforms.""","President Donald Trump's crypto ventures are getting in the way of his own agenda.
The fate of a bipartisan stablecoin bill has fallen into doubt as congressional Democrats show frustration with the… [+2331 chars]",Business Insider,fdemott@businessinsider.com (Filip De Mott),https://www.businessinsider.com/trump-crypto-memecoin-stablecoin-bill-democrats-genius-act-2025-5,2025-05-07T18:31:50Z,en,Trump's crypto dealings are jeopardizing a bipartisan stablecoin bill,"President Donald Trump's crypto ventures are getting in the way of his own agenda.
The fate of a bipartisan stablecoin bill has fallen into doubt as congressional Democrats show frustration with the… [+2331 chars]","Elizabeth Warren slammed Trump's crypto dealings and said a bipartisan stablecoin bill moving through Congress needs ""substantive reforms."""
Meet the 10 AI startup unicorns with tiny teams,These AI startups are hitting billion-dollar valuations with 50 employees or fewer as founders use new tech to maintain lean teams.,"Ilya Sutskever, cofounder and chief scientist at Safe Superintelligence and cofounder and former chief scientist at OpenAI.JACK GUEZ/AFP via Getty Images
<ul><li>Artificial intelligence is helping s… [+8162 chars]",Business Insider,Rebecca Torrence,https://www.businessinsider.com/ai-startup-unicorns-with-tiny-teams-2025-5,2025-05-07T09:00:02Z,en,Meet the 10 AI startup unicorns with tiny teams,"Ilya Sutskever, cofounder and chief scientist at Safe Superintelligence and cofounder and former chief scientist at OpenAI.JACK GUEZ/AFP via Getty Images
<ul><li>Artificial intelligence is helping s… [+8162 chars]",These AI startups are hitting billion-dollar valuations with 50 employees or fewer as founders use new tech to maintain lean teams.
Trump's first trade deal has Wall Street cheering. Not everyone is convinced.,"Trump's signal that he wants to resolve trade disputes has Wall Street excited, but there's no guarantee others will be willing to come to the table.","Trump is addressing Congress for the first time in more than five years — the last time was his final State of the Union.Mario Tama/Getty Images
<ul><li>This post originally appeared in the Business… [+7049 chars]",Business Insider,Dan DeFrancesco,https://www.businessinsider.com/investors-are-loving-trumps-first-trade-deal-2025-5,2025-05-09T12:20:45Z,en,Trump's first trade deal has Wall Street cheering. Not everyone is convinced.,"Trump is addressing Congress for the first time in more than five years — the last time was his final State of the Union.Mario Tama/Getty Images
<ul><li>This post originally appeared in the Business… [+7049 chars]","Trump's signal that he wants to resolve trade disputes has Wall Street excited, but there's no guarantee others will be willing to come to the table."
Trump is headed to Saudi Arabia — and a 'who's who' of US CEOs are right behind him,"Executives from Google, Nvidia, and BlackRock are slated to speak at the Saudi-US Investment Forum as Trump courts Saudi investments.","As President Donald Trump embarks on the first international trip of his second term, a small crowd of Wall Street and Silicon Valley executives are also jetting off to Saudi Arabia.
On Tuesday, exe… [+6036 chars]",Business Insider,atecotzky@businessinsider.com (Alice Tecotzky),https://www.businessinsider.com/trump-saudi-arabia-investment-conference-business-tech-leaders-2025-5,2025-05-12T21:09:17Z,en,Trump is headed to Saudi Arabia — and a 'who's who' of US CEOs are right behind him,"As President Donald Trump embarks on the first international trip of his second term, a small crowd of Wall Street and Silicon Valley executives are also jetting off to Saudi Arabia.
On Tuesday, exe… [+6036 chars]","Executives from Google, Nvidia, and BlackRock are slated to speak at the Saudi-US Investment Forum as Trump courts Saudi investments."
The Seed 100: The best early-stage investors of 2025,Business Insider's annual Seed 100 list recognizes the early-stage investors who provide crucial support to budding startups.,"Behind every great company, there was a prescient early investor who planted the seed that helped it grow into a redwood.
For Facebook, that investor was Peter Thiel. For DoorDash and Opendoor, it w… [+89259 chars]",Business Insider,"vpersaud@insider.com (Vishal Persaud,Ben Bergman,Julia Hornstein,Leena Rao,Melia Russell,Samantha Stokes,Rebecca Torrence)",https://www.businessinsider.com/seed-100-best-early-stage-vc-investors-2025-5,2025-05-12T09:00:02Z,en,The Seed 100: The best early-stage investors of 2025,"Behind every great company, there was a prescient early investor who planted the seed that helped it grow into a redwood.
For Facebook, that investor was Peter Thiel. For DoorDash and Opendoor, it w… [+89259 chars]",Business Insider's annual Seed 100 list recognizes the early-stage investors who provide crucial support to budding startups.
"AI companies were handed a major victory in Trump's signature bill, but they shouldn't celebrate quite yet",GOP lawmakers would grant OpenAI one of its wishes by blocking states from imposing their own AI regulations for at least 10 years.,"House Energy and Commerce Committee chairman Rep. Brett Guthrie of Kentucky included a major AI proposal in his committee's section of President Donald Trump's ""Big Beautiful Bill.""Tom Williams/CQ Ro… [+2992 chars]",Business Insider,Brent D. Griffiths,https://www.businessinsider.com/ai-regulations-10-years-trump-big-beautiful-bill-2025-5,2025-05-13T16:09:34Z,en,"AI companies were handed a major victory in Trump's signature bill, but they shouldn't celebrate quite yet","House Energy and Commerce Committee chairman Rep. Brett Guthrie of Kentucky included a major AI proposal in his committee's section of President Donald Trump's ""Big Beautiful Bill.""Tom Williams/CQ Ro… [+2992 chars]",GOP lawmakers would grant OpenAI one of its wishes by blocking states from imposing their own AI regulations for at least 10 years.
"Coinbase stock is surging, with the exchange set to be the first crypto firm in the S&P 500",Shares of Coinbase rose sharply Tuesday on news that it would be included in the benchmark S&P 500 this month.,"The move: Coinbase stock rose as much as 15% on Tuesday, reaching an intraday high of $240.13per share. The stock is down 4.5% year-to-date. 
Why: The biggest US cryptocurrency exchange is set to be… [+781 chars]",Business Insider,fdemott@businessinsider.com (Filip De Mott),https://www.businessinsider.com/coinbase-stock-price-sp500-rally-crypto-exchange-sp500-market-bitcoin-2025-5,2025-05-13T13:59:20Z,en,"Coinbase stock is surging, with the exchange set to be the first crypto firm in the S&P 500","The move: Coinbase stock rose as much as 15% on Tuesday, reaching an intraday high of $240.13per share. The stock is down 4.5% year-to-date. 
Why: The biggest US cryptocurrency exchange is set to be… [+781 chars]",Shares of Coinbase rose sharply Tuesday on news that it would be included in the benchmark S&P 500 this month.
Brevan Howard hires longtime JPMorgan dealmaker Carlos Hernandez as its first executive chair,"The $34 billion asset manager is now run by CEO Aron Landy, who took over for billionaire Alan Howard in 2020.","Carlos Hernandez worked under Jamie Dimon at JPMorgan Chase.REUTERS/Lucas Jackson
<ul><li>Brevan Howard Group hired Carlos Hernandez, a longtime JPMorgan dealmaker, as its first executive chair.</li… [+2371 chars]",Business Insider,Bradley Saacks,https://www.businessinsider.com/brevan-howard-hires-longtime-jpmorgan-dealmaker-carlos-hernandez-2025-5,2025-05-13T13:00:02Z,en,Brevan Howard hires longtime JPMorgan dealmaker Carlos Hernandez as its first executive chair,"Carlos Hernandez worked under Jamie Dimon at JPMorgan Chase.REUTERS/Lucas Jackson
<ul><li>Brevan Howard Group hired Carlos Hernandez, a longtime JPMorgan dealmaker, as its first executive chair.</li… [+2371 chars]","The $34 billion asset manager is now run by CEO Aron Landy, who took over for billionaire Alan Howard in 2020."
The Seed 40: The best women early-stage investors of 2025,Business Insider's Seed 40 list celebrates the top women early-stage investors who provide crucial support to budding startups.,"Courtesy of Ann Miura-Ko, Enke Bashllari, Anne Dwane, Karin Klein, Varsha Rao, Ava Horton/BI
Early-stage investors take some of the biggest — and boldest — swings in venture capital.Our Seed 40 list… [+37385 chars]",Business Insider,"Vishal Persaud,Ben Bergman,Julia Hornstein,Leena Rao,Melia Russell,Samantha Stokes,Rebecca Torrence",https://www.businessinsider.com/seed-40-best-women-early-stage-vc-investors-2025-5,2025-05-13T09:00:02Z,en,The Seed 40: The best women early-stage investors of 2025,"Courtesy of Ann Miura-Ko, Enke Bashllari, Anne Dwane, Karin Klein, Varsha Rao, Ava Horton/BI
Early-stage investors take some of the biggest — and boldest — swings in venture capital.Our Seed 40 list… [+37385 chars]",Business Insider's Seed 40 list celebrates the top women early-stage investors who provide crucial support to budding startups.
