title,description,content,source,author,url,publishedAt,language,translated_title,translated_content,translated_description
"Holding cash, leveraged funds, bitcoin: Here's how retail investors are coping with volatile markets",Trump's tariffs are hitting portfolios hard. Here's how retail investors are weathering the storm.,"Tariff announcements that change by the hour, record-breaking market fluctuations, and stocks flirting with bear-market territory President Donald Trump's trade war has thrown the investment landscap… [+5062 chars]",Business Insider,cji@businessinsider.com (Christine Ji),https://www.businessinsider.com/retail-investors-trump-trade-war-stock-market-panic-bitcoin-tariffs-2025-4,2025-04-16T18:09:34Z,en,"Holding cash, leveraged funds, bitcoin: Here's how retail investors are coping with volatile markets","Tariff announcements that change by the hour, record-breaking market fluctuations, and stocks flirting with bear-market territory President Donald Trump's trade war has thrown the investment landscap… [+5062 chars]",Trump's tariffs are hitting portfolios hard. Here's how retail investors are weathering the storm.
Tesla's struggling stock just saw a dreaded 'death cross' that could signal further losses,"It's Tesla's first death cross since May 2022, the early days of a brutal bear market sell-off.","Major stock indexes flashed so-called ""death cross"" signals this week. On Tuesday, it was Tesla's turn.
Shares of the EV-maker met the definition of a death cross when their 50-day moving average ($… [+1494 chars]",Business Insider,mfox@businessinsider.com (Matthew Fox),https://www.businessinsider.com/death-cross-formation-tesla-stock-price-bearish-signal-tariff-volatility-2025-4,2025-04-15T15:53:12Z,en,Tesla's struggling stock just saw a dreaded 'death cross' that could signal further losses,"Major stock indexes flashed so-called ""death cross"" signals this week. On Tuesday, it was Tesla's turn.
Shares of the EV-maker met the definition of a death cross when their 50-day moving average ($… [+1494 chars]","It's Tesla's first death cross since May 2022, the early days of a brutal bear market sell-off."
White House AI and crypto czar David Sacks points out one part of the government that needs more money,"David Sacks, the White House crypto czar, said the Bureau of Industry and Security needs more resources to enforce export controls on US-made chips.","David Sacks, the White House's AI and crypto czar, is a strong proponent of DOGE's work to slash the size of the US government.
But one area he said could use more resources is at a little-mentioned… [+1697 chars]",Business Insider,lloydlee@insider.com (Lloyd Lee),https://www.businessinsider.com/david-sacks-nvidia-export-controls-crackdown-bis-more-funding-2025-4,2025-04-20T03:56:47Z,en,White House AI and crypto czar David Sacks points out one part of the government that needs more money,"David Sacks, the White House's AI and crypto czar, is a strong proponent of DOGE's work to slash the size of the US government.
But one area he said could use more resources is at a little-mentioned… [+1697 chars]","David Sacks, the White House crypto czar, said the Bureau of Industry and Security needs more resources to enforce export controls on US-made chips."
Wall Street money managers are betting on gold above all else. 4 other investments in their bear-market survival kit.,"Wall Street fund managers are going ""risk-off"" doubling down on gold and reducing tech holdings, according to Bank of America","If the trade war is making you fear for your portfolio, you're not alone.
Institutional investors are also on high alert. Bank of America's latest Fund Manager Survey shows that the biggest money ma… [+3713 chars]",Business Insider,cji@businessinsider.com (Christine Ji),https://www.businessinsider.com/top-investments-right-now-fund-manager-survey-bofa-gold-tariffs-2025-4,2025-04-19T10:10:03Z,en,Wall Street money managers are betting on gold above all else. 4 other investments in their bear-market survival kit.,"If the trade war is making you fear for your portfolio, you're not alone.
Institutional investors are also on high alert. Bank of America's latest Fund Manager Survey shows that the biggest money ma… [+3713 chars]","Wall Street fund managers are going ""risk-off"" doubling down on gold and reducing tech holdings, according to Bank of America"
These are the big winners as the US dollar weakens,"The US dollar's sharp decline this year stands to benefit commodities, export-driven economies, and haven assets such as gold.","The US dollar, the bedrock of global finance, has weakened by nearly 10% from its mid-January peak to a three-year low against a basket of major currencies.
A key catalyst has been President Donald … [+2946 chars]",Business Insider,tmohamed@businessinsider.com (Theron Mohamed),https://www.businessinsider.com/us-dollar-trump-tariffs-winners-haven-currencies-commodities-exports-gold-2025-4,2025-04-19T08:47:01Z,en,These are the big winners as the US dollar weakens,"The US dollar, the bedrock of global finance, has weakened by nearly 10% from its mid-January peak to a three-year low against a basket of major currencies.
A key catalyst has been President Donald … [+2946 chars]","The US dollar's sharp decline this year stands to benefit commodities, export-driven economies, and haven assets such as gold."
Record-shattering gold is proving its worth as the ultimate safe haven for investors,"Gold has crushed the S&P 500 this year, as risk assets and even traditional safe haven trades struggle against tariff fears.","Gold is trouncing other assets in 2025. 
The precious metal's record-setting year is a sign that investorsracked by uncertainty over tariffs, the economy, and inflationsee it as a place to hide whil… [+2641 chars]",Business Insider,jsor@businessinsider.com (Jennifer Sor),https://www.businessinsider.com/gold-price-today-record-bullion-rally-safe-haven-commodities-investing-2025-4,2025-04-22T18:10:21Z,en,Record-shattering gold is proving its worth as the ultimate safe haven for investors,"Gold is trouncing other assets in 2025. 
The precious metal's record-setting year is a sign that investorsracked by uncertainty over tariffs, the economy, and inflationsee it as a place to hide whil… [+2641 chars]","Gold has crushed the S&P 500 this year, as risk assets and even traditional safe haven trades struggle against tariff fears."
Law firm that hired former Mueller prosecutors teams up with Trump Media to work on crypto,Davis Polk will work with Truth Social's parent company on a cryptocurrency venture.,"A social media company mostly owned by President Donald Trump's family trust announced on Tuesday that it's partnering with one of the nation's richest law firms to launch a crypto venture.
Trump Me… [+2472 chars]",Business Insider,"bgriffiths@insider.com (Brent D. Griffiths,Jack Newsham)",https://www.businessinsider.com/big-law-trump-media-crypto-etfs-davis-polk-2025-4,2025-04-22T17:04:35Z,en,Law firm that hired former Mueller prosecutors teams up with Trump Media to work on crypto,"A social media company mostly owned by President Donald Trump's family trust announced on Tuesday that it's partnering with one of the nation's richest law firms to launch a crypto venture.
Trump Me… [+2472 chars]",Davis Polk will work with Truth Social's parent company on a cryptocurrency venture.
A tiny internet company's stock spiked 335% on plans to mimic Michael Saylor's crypto playbook,Upexi stock jumped by triple digits after it announced a private investment deal to fuel its purchase of solana tokens.,"Upexi notched a triple-digit stock gain on Monday after announcing plans to accumulate millions worth of crypto.
The self-described brand owner, specializing in the ""development, manufacturing, and … [+1502 chars]",Business Insider,fdemott@businessinsider.com (Filip De Mott),https://www.businessinsider.com/upexi-stock-price-rally-solana-crypto-strategy-saylor-mastr-bitcoin-2025-4,2025-04-21T20:13:50Z,en,A tiny internet company's stock spiked 335% on plans to mimic Michael Saylor's crypto playbook,"Upexi notched a triple-digit stock gain on Monday after announcing plans to accumulate millions worth of crypto.
The self-described brand owner, specializing in the ""development, manufacturing, and … [+1502 chars]",Upexi stock jumped by triple digits after it announced a private investment deal to fuel its purchase of solana tokens.
What Elon Musk is really up to at DOGE: 4 plausible theories,DOGE isn't saving much money. So what is Elon Musk it really up to?,"If Elon Musk's effort to remake the federal government was ever really about ""waste, fraud, and abuse,""
 those DOGE days are over. His quasi-agency has made huge and unprecedented changes to what th… [+12823 chars]",Business Insider,arogers@businessinsider.com (Adam Rogers),https://www.businessinsider.com/elon-musk-doge-cuts-federal-worker-firings-government-plan-2025-4,2025-04-21T08:04:01Z,en,What Elon Musk is really up to at DOGE: 4 plausible theories,"If Elon Musk's effort to remake the federal government was ever really about ""waste, fraud, and abuse,""
 those DOGE days are over. His quasi-agency has made huge and unprecedented changes to what th… [+12823 chars]",DOGE isn't saving much money. So what is Elon Musk it really up to?
Trump's official store is selling a 'Trump 2028' hat for $50,The Trump Organization is selling 2028 merchandise that winks at the possibility of an unconstitutional run by President Donald Trump.,"President Donald Trump's family business is cashing in on his flirtation with a 2028 run, even though it's unconstitutional for him to seek the White House again.
On Thursday, the Trump Organization… [+1751 chars]",Business Insider,bgriffiths@insider.com (Brent D. Griffiths),https://www.businessinsider.com/trump-selling-2028-merchandise-2025-4,2025-04-24T21:24:21Z,en,Trump's official store is selling a 'Trump 2028' hat for $50,"President Donald Trump's family business is cashing in on his flirtation with a 2028 run, even though it's unconstitutional for him to seek the White House again.
On Thursday, the Trump Organization… [+1751 chars]",The Trump Organization is selling 2028 merchandise that winks at the possibility of an unconstitutional run by President Donald Trump.
"17 'Harry Potter' stars, ranked from least to most successful","The first ""Harry Potter"" movie was released 24 years ago — here's how the stars' careers have progressed since.","Daniel Radcliffe, Emma Watson, and Rupert Grint starred in all eight ""Harry Potter"" films.Dave M. Benett/Getty Images
<ul><li>The first ""Harry Potter"" movie was released 24 years ago.</li><li>Ahead … [+16717 chars]",Business Insider,Gabbi Shaw,https://www.businessinsider.com/harry-potter-child-stars-ranked-success-2021-3,2025-04-24T16:14:51Z,en,"17 'Harry Potter' stars, ranked from least to most successful","Daniel Radcliffe, Emma Watson, and Rupert Grint starred in all eight ""Harry Potter"" films.Dave M. Benett/Getty Images
<ul><li>The first ""Harry Potter"" movie was released 24 years ago.</li><li>Ahead … [+16717 chars]","The first ""Harry Potter"" movie was released 24 years ago — here's how the stars' careers have progressed since."
"At this fintech, bad Karma means a lower bonus",Revolut uses a team-based points system to track compliance — and adjust employee bonuses based on department performance.,"Revolut CEO and founder Nikolay Storonsky.Storonsky
<ul><li>Fintech startup Revolut awards or docks ""Karma"" points based on how staff follow compliance rules.</li><li>These scores roll into team tot… [+2573 chars]",Business Insider,Effie Webb,https://www.businessinsider.com/revolut-karma-bonus-system-compliance-workplace-culture-2025-4,2025-04-24T12:47:34Z,en,"At this fintech, bad Karma means a lower bonus","Revolut CEO and founder Nikolay Storonsky.Storonsky
<ul><li>Fintech startup Revolut awards or docks ""Karma"" points based on how staff follow compliance rules.</li><li>These scores roll into team tot… [+2573 chars]",Revolut uses a team-based points system to track compliance — and adjust employee bonuses based on department performance.
How AI was used in this $1.5 billion M&A deal,"When Kraken, a crypto exchange, was embarking on a $1.5 billion acquisition, it used this AI startup to check under the hood.","When the crypto exchange Kraken was mulling paying $1.5 billion for a retail trading startup NinjaTrader, it was a given that Kraken would want to check under the hood.
Usually, a team of six Kraken… [+5461 chars]",Business Insider,bschan@businessinsider.com (Bianca Chan),https://www.businessinsider.com/how-ai-was-used-kraken-ninjatrader-acquisition-2025-4,2025-04-24T09:09:02Z,en,How AI was used in this $1.5 billion M&A deal,"When the crypto exchange Kraken was mulling paying $1.5 billion for a retail trading startup NinjaTrader, it was a given that Kraken would want to check under the hood.
Usually, a team of six Kraken… [+5461 chars]","When Kraken, a crypto exchange, was embarking on a $1.5 billion acquisition, it used this AI startup to check under the hood."
Palantir once bought $50 million worth of gold bars. It'd be worth nearly double today if they hadn't sold it all.,"Palantir sold its gold bars for a small profit in 2023, missing out on nearly doubling its investment as gold prices reach record highs this year.","The value of gold has reached record highs this year.Sven Hoppe/picture alliance via Getty Images
<ul><li>The price of gold has nearly doubled since Palantir bought a stockpile in 2021.</li><li>Gold… [+2571 chars]",Business Insider,Grace Eliza Goodwin,https://www.businessinsider.com/golds-value-doubled-since-palantir-bought-50-million-worth-2025-4,2025-04-23T18:01:17Z,en,Palantir once bought $50 million worth of gold bars. It'd be worth nearly double today if they hadn't sold it all.,"The value of gold has reached record highs this year.Sven Hoppe/picture alliance via Getty Images
<ul><li>The price of gold has nearly doubled since Palantir bought a stockpile in 2021.</li><li>Gold… [+2571 chars]","Palantir sold its gold bars for a small profit in 2023, missing out on nearly doubling its investment as gold prices reach record highs this year."
$Trump coin is surging again on plans for a dinner with the president and the token's top holders,The token's website said the top 25 holders of the $Trump coin would be invited to an exclusive reception with the president before the dinner.,"The $Trump token soared as much as 71% on Wednesday after the project's organizers said President Donald Trump will attend a dinner for the top 220 holders of the meme coin. 
The token, launched day… [+1394 chars]",Business Insider,mfox@businessinsider.com (Matthew Fox),https://www.businessinsider.com/trump-meme-coin-soars-s-president-host-dinner-top-holders-2025-4,2025-04-23T17:35:43Z,en,$Trump coin is surging again on plans for a dinner with the president and the token's top holders,"The $Trump token soared as much as 71% on Wednesday after the project's organizers said President Donald Trump will attend a dinner for the top 220 holders of the meme coin. 
The token, launched day… [+1394 chars]",The token's website said the top 25 holders of the $Trump coin would be invited to an exclusive reception with the president before the dinner.
Elon Musk is stepping back from DOGE to spend more time at Tesla,Musk made the announcement after Tesla delivered a dismal first-quarter earnings report.,"Elon Musk is calling for a free-trade zone between the US and Europe.BRENDAN SMIALOWSKI/AFP via Getty Images
<ul><li>This post originally appeared in the Business Insider Today newsletter.</li><li>Y… [+6293 chars]",Business Insider,Hallam Bullock,https://www.businessinsider.com/musk-step-back-doge-teslas-earning-revenue-fall-gerber-ceo-2025-4,2025-04-23T12:44:08Z,en,Elon Musk is stepping back from DOGE to spend more time at Tesla,"Elon Musk is calling for a free-trade zone between the US and Europe.BRENDAN SMIALOWSKI/AFP via Getty Images
<ul><li>This post originally appeared in the Business Insider Today newsletter.</li><li>Y… [+6293 chars]",Musk made the announcement after Tesla delivered a dismal first-quarter earnings report.
"Why a top bitcoin bull says the token is about to notch a fresh record of $120,000","Bitcoin is poised for fresh records in the second quarter thanks to tailwinds that have emerged amid policy uncertainty, Standard Chartered said.","Bitcoin's slump to start the year will give way to a fresh rally to record highs this quarter, according to Standard Chartered analyst Geoff Kendrick. 
Kendrick anticipates that the apex token will … [+2957 chars]",Business Insider,fdemott@businessinsider.com (Filip De Mott),https://www.businessinsider.com/bitcoin-price-prediction-record-high-q2-trump-crypto-whales-btc-2025-4,2025-04-28T15:39:13Z,en,"Why a top bitcoin bull says the token is about to notch a fresh record of $120,000","Bitcoin's slump to start the year will give way to a fresh rally to record highs this quarter, according to Standard Chartered analyst Geoff Kendrick. 
Kendrick anticipates that the apex token will … [+2957 chars]","Bitcoin is poised for fresh records in the second quarter thanks to tailwinds that have emerged amid policy uncertainty, Standard Chartered said."
David Sacks compares Elon Musk's time at DOGE to the Twitter acquisition,David Sacks compared Elon Musk's decision to reduce his time at DOGE to the billionaire's approach to managing Twitter during the acquisition.,"White House crypto czar David Sacks said Elon Musk focuses intensely on one venture before he goes into ""maintenance mode.""Kayla Bartkowski; Taylor Hill/Getty Images
<ul><li>Elon Musk said he will s… [+2942 chars]",Business Insider,Lloyd Lee,https://www.businessinsider.com/elon-musk-doge-maintenance-mode-david-sacks-all-in-podcast-2025-4,2025-04-27T00:44:53Z,en,David Sacks compares Elon Musk's time at DOGE to the Twitter acquisition,"White House crypto czar David Sacks said Elon Musk focuses intensely on one venture before he goes into ""maintenance mode.""Kayla Bartkowski; Taylor Hill/Getty Images
<ul><li>Elon Musk said he will s… [+2942 chars]",David Sacks compared Elon Musk's decision to reduce his time at DOGE to the billionaire's approach to managing Twitter during the acquisition.
The FTC says company that pitched financial freedom scammed people out of $1 billion,"The financial training platform said it could help subscribers make money. Some got soaked instead, the feds say.","The FTC says IYOVIA, a financial training platform, was really a multi-level marketing scheme.Getty Images; Jenny Chang-Rodriguez/BI
<ul><li>The Federal Trade Commission filed a federal complaint ac… [+5513 chars]",Business Insider,Nicole Einbinder,https://www.businessinsider.com/iyovia-ftc-mlm-scam,2025-05-02T20:22:05Z,en,The FTC says company that pitched financial freedom scammed people out of $1 billion,"The FTC says IYOVIA, a financial training platform, was really a multi-level marketing scheme.Getty Images; Jenny Chang-Rodriguez/BI
<ul><li>The Federal Trade Commission filed a federal complaint ac… [+5513 chars]","The financial training platform said it could help subscribers make money. Some got soaked instead, the feds say."
I uploaded my biometrics at the keynote for Sam Altman's buzzy crypto company. Here are 3 takeaways.,"World, a crypto and biometric security startup led by Sam Altman and Alex Blania, unveiled its vision for an 'everything app.' Here's what BI saw.","Business Insider's Lloyd Lee attended a keynote for World, a crypto and biometric security startup, that launched a digital currency in the US.Lloyd Lee/Business Insider
<ul><li>World, a crypto and … [+7550 chars]",Business Insider,Lloyd Lee,https://www.businessinsider.com/sam-altman-world-worldcoin-keynote-takeaways-orb-biometrics-2025-5,2025-05-02T11:44:01Z,en,I uploaded my biometrics at the keynote for Sam Altman's buzzy crypto company. Here are 3 takeaways.,"Business Insider's Lloyd Lee attended a keynote for World, a crypto and biometric security startup, that launched a digital currency in the US.Lloyd Lee/Business Insider
<ul><li>World, a crypto and … [+7550 chars]","World, a crypto and biometric security startup led by Sam Altman and Alex Blania, unveiled its vision for an 'everything app.' Here's what BI saw."
I went to the 'Conclave of Silicon Valley.' It showed the hold tech has on DC.,Tech titans and DC policymakers sound the alarm on China's AI and defense tech surge at the high-powered Hill and Valley Forum.,"Delian Asparouhov moderating a discussion with Emil Michael, Ruth Porat, and Kevin Weil at the Hill and Valley Forum.Julia Hornstein/BI
<ul><li>I went to the fourth Hill and Valley Forum, a mashup o… [+6581 chars]",Business Insider,Julia Hornstein,https://www.businessinsider.com/silicon-valley-descended-on-dc-talk-ai-china-rebuilding-america,2025-05-02T09:00:02Z,en,I went to the 'Conclave of Silicon Valley.' It showed the hold tech has on DC.,"Delian Asparouhov moderating a discussion with Emil Michael, Ruth Porat, and Kevin Weil at the Hill and Valley Forum.Julia Hornstein/BI
<ul><li>I went to the fourth Hill and Valley Forum, a mashup o… [+6581 chars]",Tech titans and DC policymakers sound the alarm on China's AI and defense tech surge at the high-powered Hill and Valley Forum.
Traders are pouring into shares of a new bitcoin investment that's up almost 500% in a week,"The company's aim of holding of 42,000 bitcoins would make Twenty One Capital the third-largest bitcoin treasury in the world.","Move over Strategy. There's a new bitcoin investment vehicle on Wall Street that is luring investors.
Cantor Equity Partners, a SPAC that recently struck a deal to merge with crypto firm Twenty One … [+1905 chars]",Business Insider,mfox@businessinsider.com (Matthew Fox),https://www.businessinsider.com/cantor-equity-partners-cep-stock-price-bitcoin-trading-strategy-mstr-2025-5,2025-05-01T19:07:36Z,en,Traders are pouring into shares of a new bitcoin investment that's up almost 500% in a week,"Move over Strategy. There's a new bitcoin investment vehicle on Wall Street that is luring investors.
Cantor Equity Partners, a SPAC that recently struck a deal to merge with crypto firm Twenty One … [+1905 chars]","The company's aim of holding of 42,000 bitcoins would make Twenty One Capital the third-largest bitcoin treasury in the world."
"Is Trump responsible for the performance of stocks? He thinks so, but only if they're up.","Donald Trump has used the stock market as a scorecard in the past, but the president doesn't think he's to blame for the market's year-to-date loss.","Donald Trump has used the stock market as a scorecard in the past, so it might make sense to look at a chart of the S&amp;P 500 year-to-date and wonder if the president thinks his performance could b… [+3840 chars]",Business Insider,jsor@businessinsider.com (Jennifer Sor),https://www.businessinsider.com/trump-stock-market-biden-tariffs-selloff-sp500-correction-bear-market-2025-4,2025-05-01T08:00:03Z,en,"Is Trump responsible for the performance of stocks? He thinks so, but only if they're up.","Donald Trump has used the stock market as a scorecard in the past, so it might make sense to look at a chart of the S&amp;P 500 year-to-date and wonder if the president thinks his performance could b… [+3840 chars]","Donald Trump has used the stock market as a scorecard in the past, but the president doesn't think he's to blame for the market's year-to-date loss."
"Amazon is working on a secret project called 'Kiro,' a new tool that uses AI agents to streamline software coding",Amazon's AI coding assistant 'Kiro' is designed to use AI agents and a multi-modal interface to streamline software development.,"AI coding assistants are exploding in popularity. Amazon wants a piece of it.
According to an internal document obtained by Business Insider, Amazon Web Services is building a new AI coding tool, co… [+4311 chars]",Business Insider,ekim@businessinsider.com (Eugene Kim),https://www.businessinsider.com/amazon-kiro-project-ai-agents-software-coding-2025-5,2025-05-06T17:48:41Z,en,"Amazon is working on a secret project called 'Kiro,' a new tool that uses AI agents to streamline software coding","AI coding assistants are exploding in popularity. Amazon wants a piece of it.
According to an internal document obtained by Business Insider, Amazon Web Services is building a new AI coding tool, co… [+4311 chars]",Amazon's AI coding assistant 'Kiro' is designed to use AI agents and a multi-modal interface to streamline software development.
New Hampshire just became the first state to establish a crypto reserve,New Hampshire is the first state to approve purchases of digital assets by its state treasurer. Bills have surfaced in other states but have lost steam.,"Legislators in New Hampshire voted to pass a bill that establishes the first state crypto reserve.
""New Hampshire is once again First in the Nation!"" state governor Kelly Ayotte wrote on X. ""Just si… [+1949 chars]",Business Insider,fdemott@businessinsider.com (Filip De Mott),https://www.businessinsider.com/bitcoin-reserve-new-hampshire-crypto-cryptocurrency-trump-btc-2025-5,2025-05-06T17:41:11Z,en,New Hampshire just became the first state to establish a crypto reserve,"Legislators in New Hampshire voted to pass a bill that establishes the first state crypto reserve.
""New Hampshire is once again First in the Nation!"" state governor Kelly Ayotte wrote on X. ""Just si… [+1949 chars]",New Hampshire is the first state to approve purchases of digital assets by its state treasurer. Bills have surfaced in other states but have lost steam.
